[
  {
    "secondary_muscle_groups": [
      "ARMS",
      "SHOULDERS"
    ],
    "secondary_target_zones": [
      "TRICEPS_LATERAL",
      "FRONT_DELT"
    ],
    "movement_plane": "SAGITTAL",
    "rom_priority": "FULL",
    "tags": [
      "MASS_BUILDER",
      "POWERLIFT"
    ],
    "contraindications": [],
    "swap_candidates": [
      "DB_FLAT_BENCH_PRESS",
      "PUSH_UP"
    ],
    "instruction_cues": [],
    "id": "BB_BENCH_PRESS",
    "name": "Barbell Bench Press",
    "primary_muscle_group": "CHEST",
    "primary_target_zone": "MID_CHEST",
    "mechanics": "COMPOUND",
    "force": "PUSH",
    "required_equipment": [
      "BARBELL",
      "BENCH",
      "RACK"
    ],
    "difficulty": "INTERMEDIATE",
    "fatigue_index": 8,
    "default_tempo": "2-0-1-0"
  },
  {
    "secondary_muscle_groups": [
      "ARMS",
      "SHOULDERS"
    ],
    "secondary_target_zones": [
      "TRICEPS_LATERAL",
      "FRONT_DELT"
    ],
    "movement_plane": "SAGITTAL",
    "rom_priority": "FULL",
    "tags": [
      "MASS_BUILDER"
    ],
    "contraindications": [],
    "swap_candidates": [
      "DB_INCLINE_BENCH_PRESS"
    ],
    "instruction_cues": [],
    "id": "BB_INCLINE_BENCH_PRESS",
    "name": "Barbell Incline Bench Press",
    "primary_muscle_group": "CHEST",
    "primary_target_zone": "UPPER_CHEST",
    "mechanics": "COMPOUND",
    "force": "PUSH",
    "required_equipment": [
      "BARBELL",
      "BENCH",
      "RACK"
    ],
    "difficulty": "INTERMEDIATE",
    "fatigue_index": 8,
    "default_tempo": "2-0-1-0"
  },
  {
    "secondary_muscle_groups": [
      "ARMS"
    ],
    "secondary_target_zones": [
      "TRICEPS_LATERAL"
    ],
    "movement_plane": "SAGITTAL",
    "rom_priority": "FULL",
    "tags": [],
    "contraindications": [],
    "swap_candidates": [
      "DIP_CHEST"
    ],
    "instruction_cues": [],
    "id": "BB_DECLINE_BENCH_PRESS",
    "name": "Barbell Decline Bench Press",
    "primary_muscle_group": "CHEST",
    "primary_target_zone": "LOWER_CHEST",
    "mechanics": "COMPOUND",
    "force": "PUSH",
    "required_equipment": [
      "BARBELL",
      "BENCH",
      "RACK"
    ],
    "difficulty": "INTERMEDIATE",
    "fatigue_index": 7,
    "default_tempo": "2-0-1-0"
  },
  {
    "secondary_muscle_groups": [
      "ARMS",
      "SHOULDERS"
    ],
    "secondary_target_zones": [
      "TRICEPS_LATERAL",
      "FRONT_DELT"
    ],
    "movement_plane": "SAGITTAL",
    "rom_priority": "FULL",
    "tags": [],
    "contraindications": [],
    "swap_candidates": [
      "BB_BENCH_PRESS"
    ],
    "instruction_cues": [],
    "id": "DB_FLAT_BENCH_PRESS",
    "name": "Dumbbell Flat Bench Press",
    "primary_muscle_group": "CHEST",
    "primary_target_zone": "MID_CHEST",
    "mechanics": "COMPOUND",
    "force": "PUSH",
    "required_equipment": [
      "DUMBBELL",
      "BENCH"
    ],
    "difficulty": "BEGINNER",
    "fatigue_index": 6,
    "default_tempo": "2-0-1-0"
  },
  {
    "secondary_muscle_groups": [
      "ARMS",
      "SHOULDERS"
    ],
    "secondary_target_zones": [
      "TRICEPS_LATERAL",
      "FRONT_DELT"
    ],
    "movement_plane": "SAGITTAL",
    "rom_priority": "FULL",
    "tags": [],
    "contraindications": [],
    "swap_candidates": [
      "BB_INCLINE_BENCH_PRESS"
    ],
    "instruction_cues": [],
    "id": "DB_INCLINE_BENCH_PRESS",
    "name": "Dumbbell Incline Bench Press",
    "primary_muscle_group": "CHEST",
    "primary_target_zone": "UPPER_CHEST",
    "mechanics": "COMPOUND",
    "force": "PUSH",
    "required_equipment": [
      "DUMBBELL",
      "BENCH"
    ],
    "difficulty": "BEGINNER",
    "fatigue_index": 6,
    "default_tempo": "2-0-1-0"
  },
  {
    "secondary_muscle_groups": [
      "ARMS"
    ],
    "secondary_target_zones": [
      "TRICEPS_LATERAL"
    ],
    "movement_plane": "SAGITTAL",
    "rom_priority": "FULL",
    "tags": [],
    "contraindications": [
      "WRIST_HYPEREXTENSION"
    ],
    "swap_candidates": [
      "BB_DECLINE_BENCH_PRESS"
    ],
    "instruction_cues": [],
    "id": "DIP_CHEST",
    "name": "Chest Dip",
    "primary_muscle_group": "CHEST",
    "primary_target_zone": "LOWER_CHEST",
    "mechanics": "COMPOUND",
    "force": "PUSH",
    "required_equipment": [
      "DIP_BAR",
      "BODYWEIGHT"
    ],
    "difficulty": "INTERMEDIATE",
    "fatigue_index": 7,
    "default_tempo": "3-0-1-0"
  },
  {
    "secondary_muscle_groups": [
      "ARMS",
      "CORE"
    ],
    "secondary_target_zones": [
      "TRICEPS_LATERAL",
      "TRANSVERSE"
    ],
    "movement_plane": "SAGITTAL",
    "rom_priority": "FULL",
    "tags": [
      "BEGINNER_FRIENDLY"
    ],
    "contraindications": [],
    "swap_candidates": [],
    "instruction_cues": [],
    "id": "PUSH_UP",
    "name": "Push-Up",
    "primary_muscle_group": "CHEST",
    "primary_target_zone": "MID_CHEST",
    "mechanics": "COMPOUND",
    "force": "PUSH",
    "required_equipment": [
      "BODYWEIGHT"
    ],
    "difficulty": "BEGINNER",
    "fatigue_index": 4,
    "default_tempo": "2-0-1-0"
  },
  {
    "secondary_muscle_groups": [],
    "secondary_target_zones": [],
    "movement_plane": "FRONTAL",
    "rom_priority": "STRETCH_FOCUS",
    "tags": [],
    "contraindications": [],
    "swap_candidates": [
      "PEC_DECK_FLY",
      "DB_INCLINE_FLY"
    ],
    "instruction_cues": [],
    "id": "CABLE_CHEST_FLY",
    "name": "Cable Chest Fly",
    "primary_muscle_group": "CHEST",
    "primary_target_zone": "MID_CHEST",
    "mechanics": "ISOLATION",
    "force": "PUSH",
    "required_equipment": [
      "CABLE"
    ],
    "difficulty": "BEGINNER",
    "fatigue_index": 3,
    "default_tempo": "2-1-1-0"
  },
  {
    "secondary_muscle_groups": [],
    "secondary_target_zones": [],
    "movement_plane": "FRONTAL",
    "rom_priority": "FULL",
    "tags": [],
    "contraindications": [],
    "swap_candidates": [
      "CABLE_CHEST_FLY"
    ],
    "instruction_cues": [],
    "id": "PEC_DECK_FLY",
    "name": "Pec Deck Fly",
    "primary_muscle_group": "CHEST",
    "primary_target_zone": "MID_CHEST",
    "mechanics": "ISOLATION",
    "force": "PUSH",
    "required_equipment": [
      "SELECTORIZED_MACHINE"
    ],
    "difficulty": "BEGINNER",
    "fatigue_index": 3,
    "default_tempo": "2-1-1-0"
  },
  {
    "secondary_muscle_groups": [],
    "secondary_target_zones": [],
    "movement_plane": "FRONTAL",
    "rom_priority": "STRETCH_FOCUS",
    "tags": [],
    "contraindications": [],
    "swap_candidates": [
      "CABLE_CHEST_FLY"
    ],
    "instruction_cues": [],
    "id": "DB_INCLINE_FLY",
    "name": "Dumbbell Incline Fly",
    "primary_muscle_group": "CHEST",
    "primary_target_zone": "UPPER_CHEST",
    "mechanics": "ISOLATION",
    "force": "PUSH",
    "required_equipment": [
      "DUMBBELL",
      "BENCH"
    ],
    "difficulty": "BEGINNER",
    "fatigue_index": 4,
    "default_tempo": "3-1-1-0"
  },
  {
    "secondary_muscle_groups": [
      "LEGS",
      "BACK"
    ],
    "secondary_target_zones": [
      "HAMSTRINGS",
      "GLUTES",
      "LATS_THICKNESS"
    ],
    "movement_plane": "SAGITTAL",
    "rom_priority": "FULL",
    "tags": [
      "POWERLIFT",
      "POSTERIOR_CHAIN"
    ],
    "contraindications": [
      "HIGH_LUMBAR_LOAD",
      "VALSALVA_HEAVY"
    ],
    "swap_candidates": [
      "BB_RDL",
      "RACK_PULL"
    ],
    "instruction_cues": [],
    "id": "BB_DEADLIFT",
    "name": "Conventional Barbell Deadlift",
    "primary_muscle_group": "BACK",
    "primary_target_zone": "LOWER_BACK",
    "mechanics": "COMPOUND",
    "force": "HINGE",
    "required_equipment": [
      "BARBELL"
    ],
    "difficulty": "ADVANCED",
    "fatigue_index": 10,
    "default_tempo": "2-0-X-0"
  },
  {
    "secondary_muscle_groups": [
      "BACK",
      "ARMS"
    ],
    "secondary_target_zones": [
      "MID_BACK",
      "BICEPS_LONG"
    ],
    "movement_plane": "SAGITTAL",
    "rom_priority": "FULL",
    "tags": [],
    "contraindications": [
      "HIGH_LUMBAR_LOAD"
    ],
    "swap_candidates": [
      "T_BAR_ROW",
      "DB_ONE_ARM_ROW"
    ],
    "instruction_cues": [],
    "id": "BB_BENT_OVER_ROW",
    "name": "Barbell Bent-Over Row",
    "primary_muscle_group": "BACK",
    "primary_target_zone": "LATS_THICKNESS",
    "mechanics": "COMPOUND",
    "force": "PULL",
    "required_equipment": [
      "BARBELL"
    ],
    "difficulty": "INTERMEDIATE",
    "fatigue_index": 8,
    "default_tempo": "2-0-1-0"
  },
  {
    "secondary_muscle_groups": [
      "BACK",
      "ARMS"
    ],
    "secondary_target_zones": [
      "MID_BACK",
      "BICEPS_LONG"
    ],
    "movement_plane": "SAGITTAL",
    "rom_priority": "FULL",
    "tags": [],
    "contraindications": [],
    "swap_candidates": [
      "BB_BENT_OVER_ROW"
    ],
    "instruction_cues": [],
    "id": "DB_ONE_ARM_ROW",
    "name": "One-Arm Dumbbell Row",
    "primary_muscle_group": "BACK",
    "primary_target_zone": "LATS_THICKNESS",
    "mechanics": "COMPOUND",
    "force": "PULL",
    "required_equipment": [
      "DUMBBELL",
      "BENCH"
    ],
    "difficulty": "BEGINNER",
    "fatigue_index": 5,
    "default_tempo": "2-0-1-0"
  },
  {
    "secondary_muscle_groups": [
      "BACK",
      "ARMS"
    ],
    "secondary_target_zones": [
      "LATS_THICKNESS",
      "BICEPS_LONG"
    ],
    "movement_plane": "SAGITTAL",
    "rom_priority": "FULL",
    "tags": [],
    "contraindications": [
      "HIGH_LUMBAR_LOAD"
    ],
    "swap_candidates": [
      "BB_BENT_OVER_ROW"
    ],
    "instruction_cues": [],
    "id": "T_BAR_ROW",
    "name": "T-Bar Row",
    "primary_muscle_group": "BACK",
    "primary_target_zone": "MID_BACK",
    "mechanics": "COMPOUND",
    "force": "PULL",
    "required_equipment": [
      "BARBELL"
    ],
    "difficulty": "INTERMEDIATE",
    "fatigue_index": 7,
    "default_tempo": "2-0-1-0"
  },
  {
    "secondary_muscle_groups": [
      "ARMS",
      "BACK"
    ],
    "secondary_target_zones": [
      "BICEPS_LONG",
      "MID_BACK"
    ],
    "movement_plane": "SAGITTAL",
    "rom_priority": "FULL",